assertion_id	text	current_evidence	needed_evidence	priority_1to3	notes
W1	"Austria has robust EMC lab coverage."	None captured	Registry scopes, client base, equipment	2	
W2	"Standards roles give Austria outsized influence."	1 named author	Editorship, draft adoption data	2	
W3	"VSC enables world-class AI research."	Infrastructure exists	Usage metrics, output quality	1	
W4	"Supply chain exposure is minimal."	Geographic analysis	Actual flow data, customs records	2	
W5	"All partnerships are Western-aligned."	Current screening	Deeper subsidiary analysis	3	
W6	"Photonics capability exists."	Sector mention	Lab equipment, publications	2	